[
  {
    "id": "recurring-figure-01",
    "name": "Recurring Figure 01",
    "summary": "An anonymised recurring dream figure associated with Hearthlands. Public preview data intentionally withholds identifying source names.",
    "map": {
      "placements": [
        {
          "x": 0.7791,
          "y": 0.6459,
          "hitRadius": 0.022,
          "artCue": "Embedded within the approved painterly scene; interaction remains visually quiet."
        }
      ],
      "visibleFromZoom": 1.35
    },
    "corpusEvidence": {
      "privacyClass": "public-safe-derived",
      "summary": "Appears in 34 Hearthlands-associated dreams in the v57 derived symbol atlas. Specific place links are included only where already verified.",
      "evidenceRefs": [
        "private:v57/hearthlands/symbol/recurring-figure-01"
      ],
      "frequency": 34,
      "frequencyStatus": "known",
      "associationStatus": "territory-specific",
      "relatedPlaceIds": [
        "current-present-house",
        "large-many-roomed-house",
        "unfamiliar-house"
      ]
    },
    "tarotCardRef": "tarot/symbol/recurring-figure-01",
    "interaction": {
      "hoverable": true,
      "clickable": true,
      "hoverLabel": true
    }
  },
  {
    "id": "recurring-figure-02",
    "name": "Recurring Figure 02",
    "summary": "An anonymised recurring dream figure associated with Hearthlands. Public preview data intentionally withholds identifying source names.",
    "map": {
      "placements": [
        {
          "x": 0.1346,
          "y": 0.5211,
          "hitRadius": 0.02,
          "artCue": "Embedded within the approved painterly scene; interaction remains visually quiet."
        }
      ],
      "visibleFromZoom": 1.45
    },
    "corpusEvidence": {
      "privacyClass": "public-safe-derived",
      "summary": "Appears in 10 Hearthlands-associated dreams in the v57 derived symbol atlas. Specific place links are included only where already verified.",
      "evidenceRefs": [
        "private:v57/hearthlands/symbol/recurring-figure-02"
      ],
      "frequency": 10,
      "frequencyStatus": "known",
      "associationStatus": "territory-specific",
      "relatedPlaceIds": []
    },
    "tarotCardRef": "tarot/symbol/recurring-figure-02",
    "interaction": {
      "hoverable": true,
      "clickable": true,
      "hoverLabel": true
    }
  },
  {
    "id": "recurring-figure-03",
    "name": "Recurring Figure 03",
    "summary": "An anonymised recurring dream figure associated with Hearthlands. Public preview data intentionally withholds identifying source names.",
    "map": {
      "placements": [
        {
          "x": 0.5213,
          "y": 0.5883,
          "hitRadius": 0.022,
          "artCue": "Embedded within the approved painterly scene; interaction remains visually quiet."
        }
      ],
      "visibleFromZoom": 1.35
    },
    "corpusEvidence": {
      "privacyClass": "public-safe-derived",
      "summary": "Appears in 28 Hearthlands-associated dreams in the v57 derived symbol atlas. Specific place links are included only where already verified.",
      "evidenceRefs": [
        "private:v57/hearthlands/symbol/recurring-figure-03"
      ],
      "frequency": 28,
      "frequencyStatus": "known",
      "associationStatus": "territory-specific",
      "relatedPlaceIds": [
        "childhood-house",
        "current-present-house",
        "unfamiliar-house"
      ]
    },
    "tarotCardRef": "tarot/symbol/recurring-figure-03",
    "interaction": {
      "hoverable": true,
      "clickable": true,
      "hoverLabel": true
    }
  },
  {
    "id": "recurring-figure-04",
    "name": "Recurring Figure 04",
    "summary": "An anonymised recurring dream figure associated with Hearthlands. Public preview data intentionally withholds identifying source names.",
    "map": {
      "placements": [
        {
          "x": 0.4979,
          "y": 0.5385,
          "hitRadius": 0.016,
          "artCue": "Embedded within the approved painterly scene; interaction remains visually quiet."
        }
      ],
      "visibleFromZoom": 2.75
    },
    "corpusEvidence": {
      "privacyClass": "public-safe-derived",
      "summary": "Appears in 2 Hearthlands-associated dreams in the v57 derived symbol atlas. Specific place links are included only where already verified.",
      "evidenceRefs": [
        "private:v57/hearthlands/symbol/recurring-figure-04"
      ],
      "frequency": 2,
      "frequencyStatus": "known",
      "associationStatus": "territory-specific",
      "relatedPlaceIds": []
    },
    "tarotCardRef": "tarot/symbol/recurring-figure-04",
    "interaction": {
      "hoverable": true,
      "clickable": true,
      "hoverLabel": false
    }
  },
  {
    "id": "recurring-figure-05",
    "name": "Recurring Figure 05",
    "summary": "An anonymised recurring dream figure associated with Hearthlands. Public preview data intentionally withholds identifying source names.",
    "map": {
      "placements": [
        {
          "x": 0.8096,
          "y": 0.6296,
          "hitRadius": 0.02,
          "artCue": "Embedded within the approved painterly scene; interaction remains visually quiet."
        }
      ],
      "visibleFromZoom": 1.45
    },
    "corpusEvidence": {
      "privacyClass": "public-safe-derived",
      "summary": "Appears in 18 Hearthlands-associated dreams in the v57 derived symbol atlas. Specific place links are included only where already verified.",
      "evidenceRefs": [
        "private:v57/hearthlands/symbol/recurring-figure-05"
      ],
      "frequency": 18,
      "frequencyStatus": "known",
      "associationStatus": "territory-specific",
      "relatedPlaceIds": [
        "childhood-house",
        "unfamiliar-house"
      ]
    },
    "tarotCardRef": "tarot/symbol/recurring-figure-05",
    "interaction": {
      "hoverable": true,
      "clickable": true,
      "hoverLabel": true
    }
  },
  {
    "id": "recurring-figure-06",
    "name": "Recurring Figure 06",
    "summary": "An anonymised recurring dream figure associated with Hearthlands. Public preview data intentionally withholds identifying source names.",
    "map": {
      "placements": [
        {
          "x": 0.7076,
          "y": 0.4775,
          "hitRadius": 0.016,
          "artCue": "Embedded within the approved painterly scene; interaction remains visually quiet."
        }
      ],
      "visibleFromZoom": 2.75
    },
    "corpusEvidence": {
      "privacyClass": "public-safe-derived",
      "summary": "Appears in 3 Hearthlands-associated dreams in the v57 derived symbol atlas. Specific place links are included only where already verified.",
      "evidenceRefs": [
        "private:v57/hearthlands/symbol/recurring-figure-06"
      ],
      "frequency": 3,
      "frequencyStatus": "known",
      "associationStatus": "territory-specific",
      "relatedPlaceIds": []
    },
    "tarotCardRef": "tarot/symbol/recurring-figure-06",
    "interaction": {
      "hoverable": true,
      "clickable": true,
      "hoverLabel": false
    }
  },
  {
    "id": "recurring-figure-07",
    "name": "Recurring Figure 07",
    "summary": "An anonymised recurring dream figure associated with Hearthlands. Public preview data intentionally withholds identifying source names.",
    "map": {
      "placements": [
        {
          "x": 0.2136,
          "y": 0.5286,
          "hitRadius": 0.018,
          "artCue": "Embedded within the approved painterly scene; interaction remains visually quiet."
        }
      ],
      "visibleFromZoom": 2.1
    },
    "corpusEvidence": {
      "privacyClass": "public-safe-derived",
      "summary": "Appears in 5 Hearthlands-associated dreams in the v57 derived symbol atlas. Specific place links are included only where already verified.",
      "evidenceRefs": [
        "private:v57/hearthlands/symbol/recurring-figure-07"
      ],
      "frequency": 5,
      "frequencyStatus": "known",
      "associationStatus": "territory-specific",
      "relatedPlaceIds": []
    },
    "tarotCardRef": "tarot/symbol/recurring-figure-07",
    "interaction": {
      "hoverable": true,
      "clickable": true,
      "hoverLabel": false
    }
  },
  {
    "id": "recurring-figure-08",
    "name": "Recurring Figure 08",
    "summary": "An anonymised recurring dream figure associated with Hearthlands. Public preview data intentionally withholds identifying source names.",
    "map": {
      "placements": [
        {
          "x": 0.5513,
          "y": 0.4945,
          "hitRadius": 0.018,
          "artCue": "Embedded within the approved painterly scene; interaction remains visually quiet."
        }
      ],
      "visibleFromZoom": 2.1
    },
    "corpusEvidence": {
      "privacyClass": "public-safe-derived",
      "summary": "Appears in 5 Hearthlands-associated dreams in the v57 derived symbol atlas. Specific place links are included only where already verified.",
      "evidenceRefs": [
        "private:v57/hearthlands/symbol/recurring-figure-08"
      ],
      "frequency": 5,
      "frequencyStatus": "known",
      "associationStatus": "territory-specific",
      "relatedPlaceIds": []
    },
    "tarotCardRef": "tarot/symbol/recurring-figure-08",
    "interaction": {
      "hoverable": true,
      "clickable": true,
      "hoverLabel": false
    }
  },
  {
    "id": "recurring-figure-09",
    "name": "Recurring Figure 09",
    "summary": "An anonymised recurring dream figure associated with Hearthlands. Public preview data intentionally withholds identifying source names.",
    "map": {
      "placements": [
        {
          "x": 0.8079,
          "y": 0.5007,
          "hitRadius": 0.016,
          "artCue": "Embedded within the approved painterly scene; interaction remains visually quiet."
        }
      ],
      "visibleFromZoom": 2.75
    },
    "corpusEvidence": {
      "privacyClass": "public-safe-derived",